{
  "schemaVersion": "1.0.0",
  "kind": "palace/context-pack",
  "goal": "unspecified",
  "roomsVisited": [
    "project-overview"
  ],
  "filesReferenced": [
    "README.md",
    "go.mod"
  ],
  "symbolsReferenced": [],
  "findings": [
    {
      "summary": "content match for goal in internal/cli/cli.go",
      "detail": "lines 121-240",
      "severity": "info",
      "file": "internal/cli/cli.go"
    },
    {
      "summary": "content match for goal in internal/collect/collect.go",
      "detail": "lines 1-120",
      "severity": "info",
      "file": "internal/collect/collect.go"
    }
  ],
  "plan": [],
  "verification": [],
  "scanId": "scan-10",
  "scanHash": "830452ab8b33bde7e0c0629e632851eb1cfc2488f6b82d59f712052bbd2537e2",
  "scanTime": "2025-12-19T08:15:26Z",
  "provenance": {
    "createdBy": "palace collect",
    "createdAt": "2025-12-19T08:15:14Z",
    "updatedBy": "palace collect",
    "updatedAt": "2025-12-19T08:15:42Z"
  }
}